{
  "$schema": "./manifest-v2.schema.json",
  "schema_version": 2,
  "benchmark_id": "codegraph-comparison-latest-v2",
  "created_at": "2026-09-07",
  "tools": {
    "repobrain": {
      "repository": "https://github.com/study8677/repobrain.git",
      "revision": "5ed6d06ded999ec4e689af97f1a9625520f00547",
      "version": "engine 0.3.2 / cli 2.0.2",
      "refresh_mode": "public_full"
    },
    "codegraph": {
      "repository": "https://github.com/colbymchenry/codegraph.git",
      "package": "@colbymchenry/codegraph",
      "release": "1.6.0",
      "npm_git_head": "dfccdf62547fcd76d343344d823a0e1998d3a89f",
      "dist_integrity": "sha512-nCN40MqmYxF7gH1QTKqlxJ1d2mzwhw3fzSdGV2wjnQKsymjM3JZnH/5rpGqhBkcUEom0qWq0WjDRvOZh2t8mFA=="
    },
    "answer_model": {
      "runner": "trae-cli",
      "requested_model": "Seed-2.1-Turbo",
      "repobrain_host_command": "trae-cli exec -m Seed-2.1-Turbo --cd {workspace} --sandbox read-only --skip-git-repo-check --ephemeral -o {output_file}",
      "timeout_seconds": 600
    }
  },
  "artifacts": {
    "work_root": ".work/v2",
    "run_root": "results/runs"
  },
  "question_files": ["config/questions-v2.json"],
  "repositories": {
    "flask": {
      "repository": "https://github.com/pallets/flask.git",
      "revision": "22d924701a6ae2e4cd01e9a15bbaf3946094af65",
      "release": "3.1.3",
      "primary_language": "Python",
      "enabled": true,
      "stress": false,
      "tracks": ["index", "fair_e2e", "unrestricted_native"],
      "corpus": {"mode": "full", "include_paths": []},
      "corpora": {
        "repobrain_query": ".work/v2/corpora/flask/repobrain-query",
        "codegraph_query": ".work/v2/corpora/flask/codegraph-query"
      }
    },
    "vite": {
      "repository": "https://github.com/vitejs/vite.git",
      "revision": "f94df87ff03b40b65e29bacdc04cc18c7bccaa4a",
      "release": "8.0.16",
      "primary_language": "TypeScript",
      "enabled": true,
      "stress": false,
      "tracks": ["index", "fair_e2e", "unrestricted_native"],
      "corpus": {"mode": "full", "include_paths": []},
      "corpora": {
        "repobrain_query": ".work/v2/corpora/vite/repobrain-query",
        "codegraph_query": ".work/v2/corpora/vite/codegraph-query"
      }
    },
    "ripgrep": {
      "repository": "https://github.com/BurntSushi/ripgrep.git",
      "revision": "e89fff89ac9af12e8d4ce9d5fd07beb408ca730f",
      "release": "15.2.0",
      "primary_language": "Rust",
      "enabled": true,
      "stress": false,
      "tracks": ["index", "fair_e2e", "unrestricted_native"],
      "corpus": {"mode": "full", "include_paths": []},
      "corpora": {
        "repobrain_query": ".work/v2/corpora/ripgrep/repobrain-query",
        "codegraph_query": ".work/v2/corpora/ripgrep/codegraph-query"
      }
    },
    "prometheus": {
      "repository": "https://github.com/prometheus/prometheus.git",
      "revision": "d7598b7141418fa35be2b5ec5d0fefb634199610",
      "release": "3.14.0",
      "primary_language": "Go",
      "enabled": true,
      "stress": false,
      "tracks": ["index", "fair_e2e", "unrestricted_native"],
      "corpus": {"mode": "full", "include_paths": []},
      "corpora": {
        "repobrain_query": ".work/v2/corpora/prometheus/repobrain-query",
        "codegraph_query": ".work/v2/corpora/prometheus/codegraph-query"
      }
    },
    "grafana": {
      "repository": "https://github.com/grafana/grafana.git",
      "revision": "56cd3e9288d8255fecebe5d05b48d191f50674b5",
      "release": "13.2.1",
      "primary_language": "TypeScript/Go",
      "enabled": true,
      "stress": true,
      "tracks": ["index", "fair_e2e", "unrestricted_native"],
      "corpus": {"mode": "full", "include_paths": []},
      "corpora": {
        "repobrain_query": ".work/v2/corpora/grafana/repobrain-query",
        "codegraph_query": ".work/v2/corpora/grafana/codegraph-query"
      }
    }
  }
}
